{
  "name": "token_budget_checkpoint",
  "version": "2.0.0",
  "events": ["PreToolUse"],
  "timeout_ms": 5000,
  "requires": ["token_budget_tracker"],
  "input_contract": "v1",
  "description": "Advisory checkpoint that warns when session token budget is exceeded. Never blocks tool use (always exit 0)."
}
